,Date,Reviews,Rating,Location
342,2021-09-13,"✅ Trip Verified |  No refund for flights cancelled 14 months ago but provided a ticket voucher valid until 30 April 2022. Tickets bought on Edreams on June 16, 2020 for a flight on July 7, 2020, from Geneva to São Paulo through London (British Airways), round trip. The LHR-GRU flight was cancelled without any explanation. I contacted both Edreams and BA a number of times in the last 14 months but they did not refund the 461 Euros that I paid.",1,France
343,2021-09-11,✅ Trip Verified |  Stranded in the lounge because I wasn't allocated a seat. This for a flight that I booked months ago. I didn't want to use them but was forced to because Emirates wasn't available. I advise travelers to shun them too and look for more customer friendly options.,2,Nigeria
344,2021-09-09,"✅ Trip Verified |  I think British Airways needs to be much clearer about what their Covid-19 ""travel flexibility"" really means, because it doesn't pass the common-sense test: I purchased a round-trip business class ticket from New York to-and-from Mykonos through London. I traveled there with no problem. The day before my return to New York, though, I took my Covid-19 test and learned that I tested positive. I tried to call the airline on the many usless numbers they provide on their website. The recorded message drones on and on about how they have no one to answer the phone because of Covid safety and simply says ""therefore we can't answer your call; try again."" No ability to leave a call-back number or a voicemail, etc. For whatever reason the BA website thought that I had bought the ticket through a third-party agent (I did not - I bought it on BA.com) and so wouldnt let me cancel or reschedule the flight on the web site. I called and called over the coming days and could not get through to the London, Athens or New York lines. Two days later after having 2 negative PCR tests (the most accurate test), I learned I was not positive and so had to buy a new $5000 return flight to the U.S. I've now been calling the BA USA customer service line for nearly a month at least every other day, never to get through. Finally did and have been told that the fact that I couldnt get on the flight because of a COVID scare counts for nothing. The fact they dont have enough people answering the phone counts for nothing. Or that I was unable to change the flight to a few days later on the web site becuase the ticket was mis-booked. They have offered that if I send them a Greek doctor's note saying that I was sick, then they'll give me a voucher for a future flight from Mykonos to New York. I am speechless at the stupidity of this whole situation. ",1,United States
345,2021-09-08,"✅ Trip Verified |  My flight from Boston to Heathrow arrived in time, but I and other passengers were not allowed to disembark the plane. We were kept in the tarmac for one hour and a half without being given sufficient information about what was causing this delay. Because of this delay, I and other passengers lost the connecting flight to Tirana. I was offered another connecting flight which was 8 hours later from the time of arrival. When I booked this flight, one of the main reasons that made me choose it was the fact that the layover was a little bit more than an hour. Turning it into an 8 hour layover I think is unacceptable and very poor customer service. It shows lack of respect for your clients and lack of commitment by this company to provide to their customers what they were promised and what they paid for. I am very disappointed by this experience.",1,United States
346,2021-09-07,"✅ Trip Verified | Year after year the British Airways (BA) service on the same route (Washington-London) is becoming worse. We just had one bad experience after another on this route in July 2021.  British Airways (BA) notified us that our connection flight to Nice was bumped from 2pm to 6pm so we had to spend an extra 4 hours in the airport during this COVID era. Their website and emails prior to our day of flight kept asking us to check UK.gov for the COVID rules and regulations for transit through London which said that no COVID test was necessary if we could show proof of vaccine, however upon our arrival at the airport they told us we needed to go to the basement to take a COVID test to show negative results. They charged us $250 per person for a rapid COVID test which was an outrage and totally unnecessary. We could have gotten the test done at a cheaper rate had we known that this was a requirement prior to our flight. Food service was horrible (they served food with lots of cheese to me while I had requested a vegan meal due to may dairy allergies). BA damaged our Samsonite luggage and they told us at the airport that we needed to report this online. We have been trying to resolve this issue since July and after asking us for photos like 10 times, they are still giving us the run around. ",1,United States
347,2021-08-27,"✅ Trip Verified |  BA used to be my go to carrier and I am a silver member. However their service seems to have gone hugely downhill. Flights get cancelled, the best alternative flights are offered and whilst in theory you can cancel or amend bookings online or on the app, invariably this is not possible. You cannot contact them by email and you may find yourself sitting on a phone for 40 plus minutes to speak to someone. If they are busy due to cancelled flights they need to employ people to answer calls and emails promptly. I was stunned by the recent cancellation to my Catania flight two weeks before I was due to travel. ",1,United Kingdom
348,2021-08-26,"✅ Trip Verified |  The entertainment system was working badly, the screen was freezing every time I wanted to open flight map. Though the aircraft was 8 years only, the window blinds worked with delays. The crew informed passengers that there would be no headphones provided as it was supposed to be a short-haul flight. After flying with Aeroflot and S7 Airlines, I expected to receive an excellent BA service, but I got only a pack of crisps and a tiny bottle of water. I think it’s unacceptable for a non-low-cost carrier to offer service like this. I can get that hot meals on board are now rare. I loved the most comfortable seats in my life! I tend to have problems with sleeping on board, but this time I didn’t even noticed my falling asleep right after takeoff. ",5,Russian Federation
349,2021-08-22,✅ Trip Verified |  I flew on British Airways Cheapest Fare which was a Hand Baggage Only fare in Economy Class. Despite this being the cheapest fare you can actually carry two pieces of cabin luggage both weighing up to 23KG each. The value for money here is incredible. The ground staff at London Heathrow are very polite and helpful. The plane was clean and the cabin crew were very smiley and polite. This was a short haul flight but we were given a free packet of crisps and a bottle of water. There was Wifi onboard which we paid £11.99 for the full flight access package and it was great. It was fast enough to stream a movie on Netflix. If you are considering between a low cost carrier and a premium carrier like BA pay the extra and fly with the premium carrier. With the generous cabin luggage allowance and the free snacks on board it may end up being cheaper and nobody claps when the plane lands.,10,United Kingdom
350,2021-08-19,✅ Trip Verified |  Very efficient evening bag drop. Security quick. Galleries North lounge was very good. Food and drinks fine. Plane left on time pre ordered door was ok. Early arrival. Fortunately only our bags were not given priority tags and came out early!,8,United Kingdom
351,2021-08-17,"✅ Trip Verified |  Me and my 1 year 11 months baby girl flew business class from Moscow Domodedovo to London Heathrow on 11 august. When we landed at Heathrow, my baby was sleeping. I asked stewards for my stroller, and they said it is going to wait for me at the and of the corridor before entrance to terminal building. I grabbed my sleeping baby, who is nearly 15 kg, and luggage bag (another 15 kg) and walked away. I went and entered the building, and met no one with my pram or just my pram left somewhere in this corridor. And there was no one to ask. Just a flow of passengers behind me and in front of me. On top of that, we landed at terminal 5,and I had to travel on a train to arrivals terminal for passport control and other procedures still on my own, holding my baby and heavy bag on my shoulder. I met no one whom I can ask for a help. First British airways representative I met was after passport control , i explained the situation and he said that I have to go downstairs and my pram will be with my suitcases.  No further assistance or help. I had to wait another hour for luggage and pram. I am absolutely frustrated, upset and disappointed! I can see that British Airways do not care about mothers with kids at all.",1,United Kingdom
352,2021-08-11,"✅ Trip Verified |  For this flight from Heathrow T5, passengers were piled into the bus and left for 30 mins at the terminal.  Very unhappy passengers - and when confronted the BA transport manager's response was ""sorry - we are still learning"". On arrival at the aircraft a gentleman who came on a wheelchair had no help with his luggage (I helped). Shame - since lounge service was very good. For the flight out from Munich BA had not (re) signed up to the now open lounge in Munich. To me looks like a systemic failing rather than a one off event.",2,Germany
353,2021-08-08,"✅ Trip Verified | BA encourage you to download verifly to speed up your check-in, this is absolutely rubbish as the desk staff don’t seem to want this, they want to see the actual forms tests etc! This wasted about 40 minutes and is pointless. The return flight again had no access to the club lounge, you pay for extras such as this as part of the business class ticket price and should by now be made available again (last 2 flight not available at NCE but this is more a part of the Covid experience). On board staff were good although one did joke to another welcome to Ryanair. On board food was very good for a short haul flight.",6,United Kingdom
354,2021-07-27,✅ Trip Verified |  They cancelled a flight I booked three months ago for some operational problem at a time where the prices are off the roof. British Airways could not give me any alternatives other than refund or a voucher. ,1,Philippines
355,2021-07-22,"✅ Trip Verified |  I’ve been flying with BA for years and never had any issues. I recently had to arrange to have surgery in Budapest and naturally wanted to fly BA. So I booked my flights from BHD to BUD via LHR online on their site. Once booked I informed the hospital and confirmed my appointment. The very next day I received an email from BA telling me they had cancelled my flight to BUD but not to worry as they had moved me to an earlier (a much earlier) flight the same day. Only problem was this earlier flight departed around two hours before my flight from BHD arrived. I would have thought that this would have flashed up on their system as being an issue, but seemingly not… *interlude* To get into Hungary during covid one needs a valid reason, with medical treatment being one. I had to fill in a very confusing form on the Hungarian police website that was a confusing mix of Hungarian and pidgin English. Anyway form filled in with flight numbers etc, emailed to the authorities there and exemption granted. So I took the earlier flight but this meant I had to fly into London the previous evening and stay overnight in a hotel. So operation booked, hotel booked, airport transfers booked immigration papers amended and re sent and admiration granted and flights re booked, what could go wrong? Around three weeks before I was due to travel, BA, rather unsportingly, decided to cancel my flight to BUD again. Needless to say I was furious. I complained to BA customer services and was given a stock excuse about covid disrupting air travel. Great excuse, only having looked at BUD arrivals info, Ryanair had been flying there once daily for at least the preceding several months. So BA’s covid excuse rang somewhat hollow. Epilogue: I got refunded most of my money from the flights I booked with BA, although they refused to refund my BHD - LHR flights because who knows? I also lost the money I had spent on a hotel and half of the money I had spent on booking airport transfers. Given the cavalier attitude BA seem to have to bookings and their indifference to ruining weeks of preparation on my part and the fact that I lost a not inconsiderable sum of money, I’ve decided to avoid BA from now on.",1,United Kingdom
356,2021-07-20,"✅ Trip Verified |  Check in well organised. No lounge in Cancun. Efficient boarding process. Given water bottle before take off, no welcome drink. Now COVID rules are being relaxed this needs to change. Menu good and food acceptable. Staff were experienced and well organised and gave a very slick on board experience. Managed to sleep a few hours. For the first time my tagged luggage was off quickly. This may reflect the fact that our flight was the only one into Gatwick at that time.",8,United Kingdom
357,2021-07-13,"✅ Trip Verified |  Departure LGW north so Aspire lounge. Bag from fine, lounge basic, on time departure. Cabin crew welcoming but only given menu, water and amenity pack. Looks like some of White Company bedding options removed. Lunch was fine and good pre meal drinks service. Not complete return to old days but getting there. Flight generally good. Early touch down. Club world luggage off last which meant a wait of 75 minutes for luggage!",7,United Kingdom
358,2021-07-09,"Not Verified |  Booked flight six months before travel, then month before the flight BA cancelled the flight giving the option to rebook for another day - bearing in mind that people have work and school that wasn't ideal on top of booked parking for over three weeks. We rebooked the flight- as suggested by them and a week later BA cancelled the rebooked flight. We were told that we will receive a refund within 10 working days. Over two weeks passed and I called again. I was informed that they can't give a time frame for processing refunds, and no refund issued yet. BA representative refuses to give contact details to the manager, they cut the phone. ",1,United Kingdom
359,2021-07-07,"Not Verified |  The airline cancelled my initial return flight with a 2 hours layover in London, and my only option was to book the next flight that has a 7-8 hours layover. That's before I board the flight to Toronto. While i understand schedule changes, and do my best to stay positive and supportive, i contacted the airline, asking for upgrades to a best seat. I asked for access to the airport lounge during my prolonged stay in the airport. They denied my ask, no explanations and no empathy. Not only that, but they ignored my subsequent ask to provide a path to escalation. Again, not the change in schedule, not the extra 5 hours layover time. Just the way they chose to treat a customer who didn't do anything wrong except trusting them with his commute. ",1,Canada
360,2021-06-27,"Not Verified |  I was traveling with my wife in business class from Seattle to Bangalore via connecting flight in London and we reserved our seats together while booking the tickets. But mysteriously they changed it later and when we got our boarding pass, they assigned 11h and 5d. Called several times but they couldn't do anything and gave us explanations like may be some one else needed those seats and there are no other seats together available. When we boarded, the whole plane was empty and still they didn't allow us to seat together. ",2,United States
361,2021-06-22,"✅ Trip Verified |  I usually avoid BA because of its appalling customer service and sneaky extra charges, but this flight was my only option. Note that BA actually charges for seat pre-selection in biz class -- 100 UK pounds in this case! Does any other airline in the world dare do that? I saved the money and waited until checkin to choose my seat for free. The seats were BA's universally derided, cramped 6-across back-to-front configuration, where you stare into the face of your seat mate an arm's length away. No other airline ever came up with this awkward arrangement --- I wonder why? No preflight drink was offered. At meal time I selected one of the three main offerings, only to be told it wasn't available -- even though there were only 3 people in my 16 seat biz section. The seat area has practically no storage except a tiny drawer at ankle level that is inaccessible when the seat is in lie flat position. The ""bed"" is the narrowest I have experienced in biz class, and is also very hard. The cabin was very cold and the blanket very thin; I had to raid blankets from two other seats just to stay warm. The amenity kit is the smallest I've ever seen in biz class -- it fits in the palm of the hand. All in all, this uncomfortable, miserly experience is hardly worth the £5,727 that BA charges for this route. I used miles to pay for my ticket -- but of course got whacked with BA's unique and notorious ""fuel surcharge"" fee of $636 for using miles.",4,United States
362,2021-06-13,"Not Verified |  Aktion airport has only recently opened its new facilities and check-in and departure certainly seemed very clean and efficient, although admittedly it’s only having to cope with a low passenger load at present. It was good to see that check-in carefully scrutinised lateral flow certificates and passenger locator forms. Thanks to just 30 passengers on board, with more than half in Club Europe, the flight took off ahead of time. Service was a little perfunctory and the food was more reminiscent of economy than business class, with too much pre-packaging - the COVID effect, presumably. Arrival into T5 was also comfortably ahead of schedule, and although we were dreading many hours of queuing at border control, we were through the e-gates and collecting our luggage just 20 minutes after landing.",8,United Kingdom
363,2021-06-07,"✅ Trip Verified |  I want to say a big thank you to Kahina Ladjouze. After frustratingly missing my flight due to M25 road closures, she helped me secure and book the next day flight without additional charges. I am really grateful.",9,Ghana
364,2021-05-30,"✅ Trip Verified | After sixteen months of being grounded by COVID, it felt almost surreal to be back in T5, heading for what to us was essential summer sun in Greece. T5 was blissfully quiet, with no queues at check-in or security, and even the Galleries South lounge was less frenetic than usual, despite families with kids similarly desperate to escape Boris Johnson’s bully boy attitude. Ordering food and beverages from one’s table seems something worth continuing, avoiding all the wastage of endlessly replenished buffets. The flights was very quiet, with just 30 pax on board, 9 of whom were in Club Europe. Boarding by row also seemed a welcome improvement on the previous ‘groups’. Service on the flight was good and the food was of the usual Do&Co quality. Landing was ahead of schedule and we were through passport control in just a few minutes after a quick check of vaccination certificates and the passenger locator form. Overall, a thoroughly reassuring, coming out of COVID, experience.",9,United Kingdom
365,2021-05-26,"✅ Trip Verified | BA cancelled flight in Dec 2020. Refund was promised in voucher form by call center. We are now 6 months down the line, 13 calls of which each is 40 min waiting time, and 16 email reminders. Conclusion is that they are just going in circles to avoid issuing any voucher. Head of call center is keeping to her empty promises.",1,South Africa
366,2021-05-15,✅ Trip Verified | Fantastic flight down to Heathrow. Crew doing their best to keep everyone happy in challenging times. Nice to see they have introduced a free snack and water. It’s a start.,9,United Kingdom
367,2021-04-24,"✅ Trip Verified |  Boarding and disembarking were greatly organised: passengers were boarded at the gate by seperate rows, from the backside to the front (business), minimizing the possiblity for jamming. Same at disembarking: passengers were asked to remain seated, then row per row was called. crew members were supporting the process. What could be improved: distribute hand-sanitizer during boarding. When snack was distributed my row (#8 business) was overlooked for some reason; after a while my seat neighbour highlighted that we did not get food - staff was surprised and fixed it, This was my first flight since one year, and I appreciated the COVID measures taken by BA - still it left some strange experience.",8,Spain
368,2021-04-07,"✅ Trip Verified | This was not my best experience with BA thus far as there were a couple of disappointments. I was happy with the fast baggage check-in. This was a bus gate which is not my favourite thing but not a blemish on the airline. The COVID protocols are not as robust as they should be, particularly attendants need to be armed with sanitizer at the cabin entrance. There was a big mix up which I find inexcusable - I and another passenger were allocated the same seat on the same plane, causing a few anxious moments and the friendly attendant had to get me another seat but I don't expect such at this level. Bottles of water were offered to every passenger which was welcome. The plane arrived 10 minutes late.",5,South Africa
369,2021-04-01,✅ Trip Verified |  Ok flight apart from they cancelled the majority of the outbound and crammed everybody on one flight. After having my return cancelled 3 times I opted for a voucher so I could rebook a new route. I had not been informed before requesting the “E-voucher” and I would need to call up to rebook (I’m in a different country and the phone tariffs are extortion). So not only was my flight cancelled 3 times I wasn’t offered an option to rebook a new flight online I was inconvenienced every step of the way.,4,United Kingdom
370,2021-03-14,"✅ Trip Verified | Absolutely appalling experience. British Airways, unfortunately, has lowered it's standards and to my dismay, I've been recently having a much better flying experience with budget airlines rather than BA. Customer service representatives are completely clueless, unprofessional and not bothered.  I recently had my flight cancelled on 3 occasions and the staff weren't interested in helping me return home.",1,United Kingdom
371,2021-02-21,"✅ Trip Verified | Had booked the above mentioned flight. But the travel restrictions changed a week before the travel dates. The airline didn’t notify me until I learned that I could not fly with the airlines only at the airport when I went for check-in. It was a single ticket with the company and they said they didn't realise I was flying from Canada to India via London. The restrictions didn't allow any via flights but were ok with direct ones. When I booked a single ticket from Canada to India, how come they didn't realise I couldn't fly? No refund at all. Gave me a credit for me to travel anytime in the next two years, but I don't have any travel plans for the next two years. That means my money is gone? When talking to representatives, they ridiculously put everything on the website agents which was 'Onetravel'. The worst experience ever with an airline. Am a frequent flyer, was trying BA for the first time but now I guess I am never going to fly with you. On my return journey, the other flight gave me a full refund when the new travel restrictions didn't allow them to take me. A poor show with BA.",1,Canada
372,2021-02-20,"✅ Trip Verified |  My return flight from Antigua to London was cancelled 2 times. When I call to BA several times their computer system didn’t work and they couldn’t issue new ticket, as the result I had to pay airport price for baggage, as I couldn’t pay online without ticket. They promised to give me compensation of hotel stay, food and travel if complete online form. When I done it, I was asked to submit expenses, but link provided was to lost baggage expenses, not what I claimed. I replied that link is wrong and asked for correct link. They replied that they wouldn’t compensate anything. ",1,United Kingdom
373,2021-02-10,Not Verified |  4 cancellations for 1 month! Applying vouchers only to find out they don't work after new cancellation! Terrible stammers. Do not recommend to anyone in Covid restrictions.,1,Bulgaria
374,2021-02-04,"✅ Trip Verified |  I had travelled to India for an eye surgery, on my flight back to London Heathrow I was assisted by a member of the cabin crew Madeline Thomas. She was an amazing person as she made sure I was feeling okay as I had come back from my surgery and was traveling by myself. She was more then a nurse and took care of my needs like a mom. She also made sure I had eaten my food and stood by next to me as I was feeling awful because I was in lot of pain",10,United Kingdom
